{"activityType":"Run","coordinates":[{"distanceM":0,"elapsedS":30,"elevationM":11.199999999999989,"latitude":35.69236423820257,"longitude":139.77525648660958},{"distanceM":138.68867788660756,"elapsedS":32,"elevationM":11.399999999999977,"latitude":35.69122555665672,"longitude":139.77463245391846},{"distanceM":314.26710865456005,"elapsedS":34,"elevationM":11.600000000000023,"latitude":35.69220447912812,"longitude":139.77613650262356},{"distanceM":366.3478379854344,"elapsedS":38,"elevationM":12,"latitude":35.691846404224634,"longitude":139.7758546192199},{"distanceM":417.7466166539918,"elapsedS":42,"elevationM":12.200000000000045,"latitude":35.69223716855049,"longitude":139.77609660476446},{"distanceM":468.86488707808087,"elapsedS":64,"elevationM":12.399999999999977,"latitude":35.692406399175525,"longitude":139.77632568217814},{"distanceM":520.6807730383239,"elapsedS":89,"elevationM":13,"latitude":35.6925511546433,"longitude":139.77658334188163},{"distanceM":576.0778794077839,"elapsedS":106,"elevationM":14.200000000000045,"latitude":35.692868661135435,"longitude":139.777041496709},{"distanceM":633.7607611312006,"elapsedS":121,"elevationM":14.399999999999977,"latitude":35.69240556098521,"longitude":139.77699464187026},{"distanceM":692.3495292185961,"elapsedS":137,"elevationM":15.399999999999977,"latitude":35.69192435592413,"longitude":139.77700578980148},{"distanceM":744.0914371644482,"elapsedS":150,"elevationM":16,"latitude":35.69154758937657,"longitude":139.77733184583485},{"distanceM":797.7500026295266,"elapsedS":173,"elevationM":16.799999999999955,"latitude":35.691215079277754,"longitude":139.77773484773934},{"distanceM":851.3719497602058,"elapsedS":187,"elevationM":18,"latitude":35.6908277515322,"longitude":139.77803676389158},{"distanceM":924.5774000775435,"elapsedS":205,"elevationM":19,"latitude":35.69106043316424,"longitude":139.77873832918704},{"distanceM":980.8892791650259,"elapsedS":225,"elevationM":19,"latitude":35.69134843535721,"longitude":139.7792416624725},{"distanceM":1037.124997423751,"elapsedS":243,"elevationM":19.399999999999977,"latitude":35.69167859852314,"longitude":139.77968657389283},{"distanceM":1088.317050206717,"elapsedS":257,"elevationM":20.399999999999977,"latitude":35.69199711084366,"longitude":139.78009301237762},{"distanceM":1140.2159787216738,"elapsedS":275,"elevationM":20,"latitude":35.692246640101075,"longitude":139.7805739659816},{"distanceM":1192.4408211962884,"elapsedS":298,"elevationM":19.799999999999955,"latitude":35.69247865118086,"longitude":139.7810261696577},{"distanceM":1263.0800877377385,"elapsedS":316,"elevationM":20.200000000000045,"latitude":35.69297444075346,"longitude":139.78150217793882},{"distanceM":1324.9940520020596,"elapsedS":331,"elevationM":20.200000000000045,"latitude":35.69291627034545,"longitude":139.78201054036617},{"distanceM":1395.641105524188,"elapsedS":349,"elevationM":20,"latitude":35.692388378083706,"longitude":139.7824424598366},{"distanceM":1465.8662074033025,"elapsedS":369,"elevationM":19.799999999999955,"latitude":35.69188102148473,"longitude":139.78290354833007},{"distanceM":1527.5720920407186,"elapsedS":389,"elevationM":20,"latitude":35.69147734902799,"longitude":139.78336882777512},{"distanceM":1590.084697549608,"elapsedS":409,"elevationM":19.600000000000023,"latitude":35.69105791859329,"longitude":139.7838268149644},{"distanceM":1643.8719235572287,"elapsedS":429,"elevationM":19.399999999999977,"latitude":35.69069196470082,"longitude":139.7842139750719},{"distanceM":1702.3649452110735,"elapsedS":475,"elevationM":17.200000000000045,"latitude":35.69026851095259,"longitude":139.78458227589726},{"distanceM":1754.5630690137498,"elapsedS":493,"elevationM":17.200000000000045,"latitude":35.68987883627415,"longitude":139.7848910652101},{"distanceM":1808.6013949846274,"elapsedS":508,"elevationM":17.399999999999977,"latitude":35.68942906334996,"longitude":139.78511142544448},{"distanceM":1870.4094975198216,"elapsedS":526,"elevationM":17.600000000000023,"latitude":35.688956743106246,"longitude":139.78543463163078},{"distanceM":1930.4713003858956,"elapsedS":555,"elevationM":17.600000000000023,"latitude":35.688453409820795,"longitude":139.78562221862376},{"distanceM":1984.5596940187206,"elapsedS":570,"elevationM":17.799999999999955,"latitude":35.688082091510296,"longitude":139.78600812144578},{"distanceM":2052.3571826839584,"elapsedS":590,"elevationM":17.600000000000023,"latitude":35.68759946152568,"longitude":139.78646024130285},{"distanceM":2114.782331818965,"elapsedS":611,"elevationM":17.200000000000045,"latitude":35.68715195171535,"longitude":139.78686307556927},{"distanceM":2177.941160046269,"elapsedS":631,"elevationM":18,"latitude":35.68666831590235,"longitude":139.78722425177693},{"distanceM":2230.8776019941524,"elapsedS":647,"elevationM":17.799999999999955,"latitude":35.68626305088401,"longitude":139.78752499446273},{"distanceM":2283.4381211318573,"elapsedS":663,"elevationM":17.200000000000045,"latitude":35.68587128072977,"longitude":139.78784677572548},{"distanceM":2338.6610513058063,"elapsedS":746,"elevationM":18,"latitude":35.68551488220692,"longitude":139.78820761665702},{"distanceM":2403.819242804731,"elapsedS":767,"elevationM":18.600000000000023,"latitude":35.68504407070577,"longitude":139.78858438320458},{"distanceM":2470.242028440713,"elapsedS":785,"elevationM":20,"latitude":35.68454694002867,"longitude":139.78898252360523},{"distanceM":2523.106283885,"elapsedS":798,"elevationM":20.600000000000023,"latitude":35.68412482738495,"longitude":139.78923691436648},{"distanceM":2574.752508501387,"elapsedS":813,"elevationM":21.600000000000023,"latitude":35.68377991206944,"longitude":139.78961711749434},{"distanceM":2631.7140699402057,"elapsedS":849,"elevationM":22.200000000000045,"latitude":35.68365468643606,"longitude":139.7898894455284},{"distanceM":2684.1376582468365,"elapsedS":865,"elevationM":21.399999999999977,"latitude":35.683483025059104,"longitude":139.7903310880065},{"distanceM":2745.784620978177,"elapsedS":880,"elevationM":23.399999999999977,"latitude":35.68312847055495,"longitude":139.79082855395973},{"distanceM":2796.5872940542145,"elapsedS":911,"elevationM":21.200000000000045,"latitude":35.683073066174984,"longitude":139.79114606045187},{"distanceM":2866.6906677752036,"elapsedS":933,"elevationM":21,"latitude":35.6825334392488,"longitude":139.79080055840313},{"distanceM":2934.144395425419,"elapsedS":952,"elevationM":21,"latitude":35.682051395997405,"longitude":139.79034818708897},{"distanceM":2991.106060516738,"elapsedS":969,"elevationM":21,"latitude":35.68163322284818,"longitude":139.7899854183197},{"distanceM":3044.0196573024486,"elapsedS":991,"elevationM":22.200000000000045,"latitude":35.68179021589458,"longitude":139.79007988236845},{"distanceM":3100.47762363734,"elapsedS":1008,"elevationM":22.200000000000045,"latitude":35.68220989778638,"longitude":139.7904312517494},{"distanceM":3157.4929378542483,"elapsedS":1025,"elevationM":22.600000000000023,"latitude":35.68262807093561,"longitude":139.79079536162317},{"distanceM":3219.016920041192,"elapsedS":1057,"elevationM":26.600000000000023,"latitude":35.68265573121607,"longitude":139.7912307176739},{"distanceM":3278.1646513808746,"elapsedS":1076,"elevationM":29,"latitude":35.682359263300896,"longitude":139.79177394881845},{"distanceM":3336.4549096942715,"elapsedS":1094,"elevationM":28.399999999999977,"latitude":35.68208911456168,"longitude":139.79232681915164},{"distanceM":3388.4746669476003,"elapsedS":1111,"elevationM":25.799999999999955,"latitude":35.68178929388523,"longitude":139.79267575778067},{"distanceM":3457.3031055127553,"elapsedS":1143,"elevationM":21.799999999999955,"latitude":35.68144630640745,"longitude":139.79210528545082},{"distanceM":3516.834048055579,"elapsedS":1161,"elevationM":21.600000000000023,"latitude":35.68103760480881,"longitude":139.7916836757213},{"distanceM":3573.439953723039,"elapsedS":1178,"elevationM":22,"latitude":35.68064826540649,"longitude":139.79128377512097},{"distanceM":3635.8802631693084,"elapsedS":1197,"elevationM":22,"latitude":35.68016563542187,"longitude":139.79093492031097},{"distanceM":3692.140759512722,"elapsedS":1214,"elevationM":21.799999999999955,"latitude":35.67973053082824,"longitude":139.79062177240849},{"distanceM":3748.8900128534415,"elapsedS":1231,"elevationM":21.399999999999977,"latitude":35.67928394302726,"longitude":139.79031910188496},{"distanceM":3806.5075109919144,"elapsedS":1248,"elevationM":21,"latitude":35.67882511764765,"longitude":139.79002330452204},{"distanceM":3861.966692852349,"elapsedS":1265,"elevationM":20.399999999999977,"latitude":35.67839370109141,"longitude":139.78972968645394},{"distanceM":3914.784726796988,"elapsedS":1280,"elevationM":19.799999999999955,"latitude":35.67798533476889,"longitude":139.78943179361522},{"distanceM":3976.6097494348537,"elapsedS":1298,"elevationM":19,"latitude":35.677497927099466,"longitude":139.78910313919187},{"distanceM":4035.2740367800934,"elapsedS":1315,"elevationM":18.600000000000023,"latitude":35.67704907618463,"longitude":139.78876769542694},{"distanceM":4105.809916336529,"elapsedS":1336,"elevationM":19.799999999999955,"latitude":35.67645580507815,"longitude":139.7885072696954},{"distanceM":4160.1217802753235,"elapsedS":1352,"elevationM":18,"latitude":35.67598641850054,"longitude":139.78835656307638},{"distanceM":4231.042973241995,"elapsedS":1373,"elevationM":19.399999999999977,"latitude":35.67535744048655,"longitude":139.7882453352213},{"distanceM":4295.663087435033,"elapsedS":1392,"elevationM":20.200000000000045,"latitude":35.67477690987289,"longitude":139.78825598023832},{"distanceM":4366.101008471628,"elapsedS":1414,"elevationM":21.600000000000023,"latitude":35.67416083998978,"longitude":139.7884155716747},{"distanceM":4418.587895877787,"elapsedS":1431,"elevationM":26.200000000000045,"latitude":35.67371156997979,"longitude":139.78859335184097},{"distanceM":4484.680339258142,"elapsedS":1452,"elevationM":29,"latitude":35.673150485381484,"longitude":139.7885886579752},{"di